{
  "gate": "marketing-publish",
  "name": "marketing-publish",
  "venture": "aml-tranche2",
  "type": "human",
  "status": "pending",
  "set_by": "template",
  "set_at": null,
  "evidence": {},
  "notes": "HUMAN GATE - publishing/sending (social, email, ads) approval. A human approves by editing status to \"approved\" OUTSIDE the agent session. The guard blocks marketer publish/send actions (Bash webhooks/CLIs or MCP send/post tools) until approved."
}
