{
  "gate": "G4",
  "name": "build",
  "venture": "aml-tranche2",
  "type": "agent",
  "status": "pending",
  "set_by": "template",
  "set_at": null,
  "evidence": {},
  "notes": "Set green by `python .claude/hooks/gate.py check <slug> G4` once required artifacts exist. The model must not edit this file directly."
}
