{
  "gate": "G3",
  "name": "design",
  "venture": "asleep-incumbent",
  "type": "agent",
  "status": "pending",
  "set_by": "template",
  "set_at": null,
  "evidence": {},
  "notes": "Set green by `python .claude/hooks/gate.py check <slug> G3` once required artifacts exist. The model must not edit this file directly."
}
