{
  "gate": "G0",
  "name": "scout",
  "venture": "support-at-home-claims",
  "type": "agent",
  "status": "green",
  "set_by": "gate.py",
  "set_at": "2026-07-20T12:18:25Z",
  "evidence": {
    "required_artifacts": [
      "research/conviction-signal.md",
      "research/opportunity-score.md"
    ],
    "missing": []
  },
  "notes": "Status derived from artifacts present on disk."
}
