{
  "gate": "G2",
  "name": "decide",
  "venture": "<venture-slug>",
  "type": "human",
  "status": "pending",
  "set_by": "template",
  "set_at": null,
  "evidence": {},
  "notes": "HUMAN GATE — go/no-go + spend authorisation. A human approves by editing this file's status to \"approved\" OUTSIDE the agent session. The model is blocked from writing here. Resource-creation/spend stays blocked until this is approved."
}
